23:25:08.980225 IP (tos 0x0, ttl 64, id 35394, offset 0, flags [DF], proto TCP (6), length 52)
    192.168.128.1.11111 > 192.168.128.254.34024: Flags [.], cksum 0x8277 (incorrect -> 0x8f40), ack 1707389723, win 501, options [nop,nop,TS val 978131738 ecr 3889317715], length 0
23:25:08.980272 IP (tos 0x0, ttl 64, id 46886, offset 0, flags [DF], proto TCP (6), length 820)
    192.168.128.254.34024 > 192.168.128.1.11111: Flags [P.], cksum 0x8577 (incorrect -> 0x86e0), seq 1:769, ack 0, win 502, options [nop,nop,TS val 3889317757 ecr 978131738], length 768
23:25:08.981654 IP (tos 0x0, ttl 64, id 35395, offset 0, flags [DF], proto TCP (6), length 52)
    192.168.128.1.11111 > 192.168.128.254.34024: Flags [.], cksum 0x8277 (incorrect -> 0x8c15), ack 769, win 501, options [nop,nop,TS val 978131739 ecr 3889317757], length 0
23:25:08.981660 IP (tos 0x0, ttl 64, id 35396, offset 0, flags [DF], proto TCP (6), length 84)
    192.168.128.1.11111 > 192.168.128.254.34024: Flags [P.], cksum 0x8297 (incorrect -> 0xf859), seq 0:32, ack 769, win 501, options [nop,nop,TS val 978131739 ecr 3889317757], length 32
23:25:08.982248 IP (tos 0x0, ttl 64, id 46887, offset 0, flags [DF], proto TCP (6), length 56)
    192.168.128.254.34024 > 192.168.128.1.11111: Flags [P.], cksum 0x827b (incorrect -> 0x7be5), seq 769:773, ack 32, win 502, options [nop,nop,TS val 3889317759 ecr 978131739], length 4
23:25:09.024206 IP (tos 0x0, ttl 64, id 35397, offset 0, flags [DF], proto TCP (6), length 52)
    192.168.128.1.11111 > 192.168.128.254.34024: Flags [.], cksum 0x8277 (incorrect -> 0x8bc4), ack 773, win 501, options [nop,nop,TS val 978131782 ecr 3889317759], length 0
23:25:09.024255 IP (tos 0x0, ttl 64, id 46888, offset 0, flags [DF], proto TCP (6), length 714)
    192.168.128.254.34024 > 192.168.128.1.11111: Flags [P.], cksum 0x850d (incorrect -> 0xcfc8), seq 773:1435, ack 32, win 502, options [nop,nop,TS val 3889317801 ecr 978131782], length 662
23:25:09.025484 IP (tos 0x0, ttl 64, id 35398, offset 0, flags [DF], proto TCP (6), length 52)
    192.168.128.1.11111 > 192.168.128.254.34024: Flags [.], cksum 0x8277 (incorrect -> 0x8903), ack 1435, win 501, options [nop,nop,TS val 978131783 ecr 3889317801], length 0
23:25:09.025489 IP (tos 0x0, ttl 64, id 35399, offset 0, flags [DF], proto TCP (6), length 84)
    192.168.128.1.11111 > 192.168.128.254.34024: Flags [P.], cksum 0x8297 (incorrect -> 0xf578), seq 32:64, ack 1435, win 501, options [nop,nop,TS val 978131783 ecr 3889317801], length 32
23:25:09.027030 IP (tos 0x0, ttl 64, id 46889, offset 0, flags [DF], proto TCP (6), length 56)
    192.168.128.254.34024 > 192.168.128.1.11111: Flags [P.], cksum 0x827b (incorrect -> 0x78d3), seq 1435:1439, ack 64, win 502, options [nop,nop,TS val 3889317803 ecr 978131783], length 4
23:25:09.068134 IP (tos 0x0, ttl 64, id 35400, offset 0, flags [DF], proto TCP (6), length 52)
    192.168.128.1.11111 > 192.168.128.254.34024: Flags [.], cksum 0x8277 (incorrect -> 0x88b2), ack 1439, win 501, options [nop,nop,TS val 978131826 ecr 3889317803], length 0
23:25:09.068188 IP (tos 0x0, ttl 64, id 46890, offset 0, flags [DF], proto TCP (6), length 644)
    192.168.128.254.34024 > 192.168.128.1.11111: Flags [P.], cksum 0x84c7 (incorrect -> 0x0739), seq 1439:2031, ack 64, win 502, options [nop,nop,TS val 3889317845 ecr 978131826], length 592
23:25:09.069035 IP (tos 0x0, ttl 64, id 35401, offset 0, flags [DF], proto TCP (6), length 52)
    192.168.128.1.11111 > 192.168.128.254.34024: Flags [.], cksum 0x8277 (incorrect -> 0x8638), ack 2031, win 501, options [nop,nop,TS val 978131826 ecr 3889317845], length 0
23:25:09.069041 IP (tos 0x0, ttl 64, id 35402, offset 0, flags [DF], proto TCP (6), length 84)
    192.168.128.1.11111 > 192.168.128.254.34024: Flags [P.], cksum 0x8297 (incorrect -> 0x23ad), seq 64:96, ack 2031, win 501, options [nop,nop,TS val 978131827 ecr 3889317845], length 32
23:25:09.070122 IP (tos 0x0, ttl 64, id 46891, offset 0, flags [DF], proto TCP (6), length 56)
    192.168.128.254.34024 > 192.168.128.1.11111: Flags [P.], cksum 0x827b (incorrect -> 0x7607), seq 2031:2035, ack 96, win 502, options [nop,nop,TS val 3889317847 ecr 978131827], length 4
23:25:09.112223 IP (tos 0x0, ttl 64, id 35403, offset 0, flags [DF], proto TCP (6), length 52)
    192.168.128.1.11111 > 192.168.128.254.34024: Flags [.], cksum 0x8277 (incorrect -> 0x85e6), ack 2035, win 501, options [nop,nop,TS val 978131870 ecr 3889317847], length 0
23:25:09.112269 IP (tos 0x0, ttl 64, id 46892, offset 0, flags [DF], proto TCP (6), length 714)
    192.168.128.254.34024 > 192.168.128.1.11111: Flags [P.], cksum 0x850d (incorrect -> 0x1a20), seq 2035:2697, ack 96, win 502, options [nop,nop,TS val 3889317889 ecr 978131870], length 662
23:25:09.113501 IP (tos 0x0, ttl 64, id 35404, offset 0, flags [DF], proto TCP (6), length 52)
    192.168.128.1.11111 > 192.168.128.254.34024: Flags [.], cksum 0x8277 (incorrect -> 0x8325), ack 2697, win 501, options [nop,nop,TS val 978131871 ecr 3889317889], length 0
23:25:09.113508 IP (tos 0x0, ttl 64, id 35405, offset 0, flags [DF], proto TCP (6), length 84)
    192.168.128.1.11111 > 192.168.128.254.34024: Flags [P.], cksum 0x8297 (incorrect -> 0xef9a), seq 96:128, ack 2697, win 501, options [nop,nop,TS val 978131871 ecr 3889317889], length 32
23:25:09.114080 IP (tos 0x0, ttl 64, id 46893, offset 0, flags [DF], proto TCP (6), length 56)
    192.168.128.254.34024 > 192.168.128.1.11111: Flags [P.], cksum 0x827b (incorrect -> 0x72f6), seq 2697:2701, ack 128, win 502, options [nop,nop,TS val 3889317890 ecr 978131871], length 4
23:25:09.156156 IP (tos 0x0, ttl 64, id 35406, offset 0, flags [DF], proto TCP (6), length 52)
    192.168.128.1.11111 > 192.168.128.254.34024: Flags [.], cksum 0x8277 (incorrect -> 0x82d5), ack 2701, win 501, options [nop,nop,TS val 978131914 ecr 3889317890], length 0
23:25:09.156203 IP (tos 0x0, ttl 64, id 46894, offset 0, flags [DF], proto TCP (6), length 714)
    192.168.128.254.34024 > 192.168.128.1.11111: Flags [P.], cksum 0x850d (incorrect -> 0x9d9a), seq 2701:3363, ack 128, win 502, options [nop,nop,TS val 3889317933 ecr 978131914], length 662
23:25:09.157167 IP (tos 0x0, ttl 64, id 35407, offset 0, flags [DF], proto TCP (6), length 52)
    192.168.128.1.11111 > 192.168.128.254.34024: Flags [.], cksum 0x8277 (incorrect -> 0x8013), ack 3363, win 501, options [nop,nop,TS val 978131915 ecr 3889317933], length 0
23:25:09.157210 IP (tos 0x0, ttl 64, id 35408, offset 0, flags [DF], proto TCP (6), length 84)
    192.168.128.1.11111 > 192.168.128.254.34024: Flags [P.], cksum 0x8297 (incorrect -> 0xec88), seq 128:160, ack 3363, win 501, options [nop,nop,TS val 978131915 ecr 3889317933], length 32
23:25:09.157688 IP (tos 0x0, ttl 64, id 46895, offset 0, flags [DF], proto TCP (6), length 56)
    192.168.128.254.34024 > 192.168.128.1.11111: Flags [P.], cksum 0x827b (incorrect -> 0x6fe4), seq 3363:3367, ack 160, win 502, options [nop,nop,TS val 3889317934 ecr 978131915], length 4
23:25:09.200143 IP (tos 0x0, ttl 64, id 35409, offset 0, flags [DF], proto TCP (6), length 52)
    192.168.128.1.11111 > 192.168.128.254.34024: Flags [.], cksum 0x8277 (incorrect -> 0x7fc3), ack 3367, win 501, options [nop,nop,TS val 978131958 ecr 3889317934], length 0
23:25:09.200188 IP (tos 0x0, ttl 64, id 46896, offset 0, flags [DF], proto TCP (6), length 644)
    192.168.128.254.34024 > 192.168.128.1.11111: Flags [P.], cksum 0x84c7 (incorrect -> 0x4a38), seq 3367:3959, ack 160, win 502, options [nop,nop,TS val 3889317977 ecr 978131958], length 592
23:25:09.201054 IP (tos 0x0, ttl 64, id 35410, offset 0, flags [DF], proto TCP (6), length 52)
    192.168.128.1.11111 > 192.168.128.254.34024: Flags [.], cksum 0x8277 (incorrect -> 0x7d47), ack 3959, win 501, options [nop,nop,TS val 978131959 ecr 3889317977], length 0
23:25:09.201094 IP (tos 0x0, ttl 64, id 35411, offset 0, flags [DF], proto TCP (6), length 84)
    192.168.128.1.11111 > 192.168.128.254.34024: Flags [P.], cksum 0x8297 (incorrect -> 0x1abd), seq 160:192, ack 3959, win 501, options [nop,nop,TS val 978131959 ecr 3889317977], length 32
23:25:09.201558 IP (tos 0x0, ttl 64, id 46897, offset 0, flags [DF], proto TCP (6), length 56)
    192.168.128.254.34024 > 192.168.128.1.11111: Flags [P.], cksum 0x827b (incorrect -> 0x6d18), seq 3959:3963, ack 192, win 502, options [nop,nop,TS val 3889317978 ecr 978131959], length 4
23:25:09.244257 IP (tos 0x0, ttl 64, id 35412, offset 0, flags [DF], proto TCP (6), length 52)
    192.168.128.1.11111 > 192.168.128.254.34024: Flags [.], cksum 0x8277 (incorrect -> 0x7cf7), ack 3963, win 501, options [nop,nop,TS val 978132002 ecr 3889317978], length 0
23:25:09.244303 IP (tos 0x0, ttl 64, id 46898, offset 0, flags [DF], proto TCP (6), length 644)
    192.168.128.254.34024 > 192.168.128.1.11111: Flags [P.], cksum 0x84c7 (incorrect -> 0x429b), seq 3963:4555, ack 192, win 502, options [nop,nop,TS val 3889318021 ecr 978132002], length 592
23:25:09.245436 IP (tos 0x0, ttl 64, id 35413, offset 0, flags [DF], proto TCP (6), length 52)
    192.168.128.1.11111 > 192.168.128.254.34024: Flags [.], cksum 0x8277 (incorrect -> 0x7a7b), ack 4555, win 501, options [nop,nop,TS val 978132003 ecr 3889318021], length 0
23:25:09.245442 IP (tos 0x0, ttl 64, id 35414, offset 0, flags [DF], proto TCP (6), length 84)
    192.168.128.1.11111 > 192.168.128.254.34024: Flags [P.], cksum 0x8297 (incorrect -> 0x17f1), seq 192:224, ack 4555, win 501, options [nop,nop,TS val 978132003 ecr 3889318021], length 32
23:25:09.245950 IP (tos 0x0, ttl 64, id 46899, offset 0, flags [DF], proto TCP (6), length 56)
    192.168.128.254.34024 > 192.168.128.1.11111: Flags [P.], cksum 0x827b (incorrect -> 0x6a4c), seq 4555:4559, ack 224, win 502, options [nop,nop,TS val 3889318022 ecr 978132003], length 4
23:25:09.288155 IP (tos 0x0, ttl 64, id 35415, offset 0, flags [DF], proto TCP (6), length 52)
    192.168.128.1.11111 > 192.168.128.254.34024: Flags [.], cksum 0x8277 (incorrect -> 0x7a2b), ack 4559, win 501, options [nop,nop,TS val 978132046 ecr 3889318022], length 0
23:25:09.288204 IP (tos 0x0, ttl 64, id 46900, offset 0, flags [DF], proto TCP (6), length 714)
    192.168.128.254.34024 > 192.168.128.1.11111: Flags [P.], cksum 0x850d (incorrect -> 0xe278), seq 4559:5221, ack 224, win 502, options [nop,nop,TS val 3889318065 ecr 978132046], length 662
23:25:09.289196 IP (tos 0x0, ttl 64, id 35416, offset 0, flags [DF], proto TCP (6), length 52)
    192.168.128.1.11111 > 192.168.128.254.34024: Flags [.], cksum 0x8277 (incorrect -> 0x7769), ack 5221, win 501, options [nop,nop,TS val 978132047 ecr 3889318065], length 0
23:25:09.289201 IP (tos 0x0, ttl 64, id 35417, offset 0, flags [DF], proto TCP (6), length 84)
    192.168.128.1.11111 > 192.168.128.254.34024: Flags [P.], cksum 0x8297 (incorrect -> 0xe3de), seq 224:256, ack 5221, win 501, options [nop,nop,TS val 978132047 ecr 3889318065], length 32
23:25:09.289710 IP (tos 0x0, ttl 64, id 46901, offset 0, flags [DF], proto TCP (6), length 56)
    192.168.128.254.34024 > 192.168.128.1.11111: Flags [P.], cksum 0x827b (incorrect -> 0x673a), seq 5221:5225, ack 256, win 502, options [nop,nop,TS val 3889318066 ecr 978132047], length 4
23:25:09.332248 IP (tos 0x0, ttl 64, id 35418, offset 0, flags [DF], proto TCP (6), length 52)
    192.168.128.1.11111 > 192.168.128.254.34024: Flags [.], cksum 0x8277 (incorrect -> 0x7719), ack 5225, win 501, options [nop,nop,TS val 978132090 ecr 3889318066], length 0
23:25:09.332296 IP (tos 0x0, ttl 64, id 46902, offset 0, flags [DF], proto TCP (6), length 714)
    192.168.128.254.34024 > 192.168.128.1.11111: Flags [P.], cksum 0x850d (incorrect -> 0x76d5), seq 5225:5887, ack 256, win 502, options [nop,nop,TS val 3889318109 ecr 978132090], length 662
23:25:09.333523 IP (tos 0x0, ttl 64, id 35419, offset 0, flags [DF], proto TCP (6), length 52)
    192.168.128.1.11111 > 192.168.128.254.34024: Flags [.], cksum 0x8277 (incorrect -> 0x7457), ack 5887, win 501, options [nop,nop,TS val 978132091 ecr 3889318109], length 0
23:25:09.333528 IP (tos 0x0, ttl 64, id 35420, offset 0, flags [DF], proto TCP (6), length 84)
    192.168.128.1.11111 > 192.168.128.254.34024: Flags [P.], cksum 0x8297 (incorrect -> 0xe0cc), seq 256:288, ack 5887, win 501, options [nop,nop,TS val 978132091 ecr 3889318109], length 32
23:25:09.334000 IP (tos 0x0, ttl 64, id 46903, offset 0, flags [DF], proto TCP (6), length 56)
    192.168.128.254.34024 > 192.168.128.1.11111: Flags [P.], cksum 0x827b (incorrect -> 0x6428), seq 5887:5891, ack 288, win 502, options [nop,nop,TS val 3889318110 ecr 978132091], length 4
23:25:09.376258 IP (tos 0x0, ttl 64, id 35421, offset 0, flags [DF], proto TCP (6), length 52)
    192.168.128.1.11111 > 192.168.128.254.34024: Flags [.], cksum 0x8277 (incorrect -> 0x7407), ack 5891, win 501, options [nop,nop,TS val 978132134 ecr 3889318110], length 0
23:25:09.376308 IP (tos 0x0, ttl 64, id 46904, offset 0, flags [DF], proto TCP (6), length 644)
    192.168.128.254.34024 > 192.168.128.1.11111: Flags [P.], cksum 0x84c7 (incorrect -> 0x5757), seq 5891:6483, ack 288, win 502, options [nop,nop,TS val 3889318153 ecr 978132134], length 592
23:25:09.377480 IP (tos 0x0, ttl 64, id 35422, offset 0, flags [DF], proto TCP (6), length 52)
    192.168.128.1.11111 > 192.168.128.254.34024: Flags [.], cksum 0x8277 (incorrect -> 0x718b), ack 6483, win 501, options [nop,nop,TS val 978132135 ecr 3889318153], length 0
23:25:09.377521 IP (tos 0x0, ttl 64, id 35423, offset 0, flags [DF], proto TCP (6), length 84)
    192.168.128.1.11111 > 192.168.128.254.34024: Flags [P.], cksum 0x8297 (incorrect -> 0x0f01), seq 288:320, ack 6483, win 501, options [nop,nop,TS val 978132135 ecr 3889318153], length 32
23:25:09.377968 IP (tos 0x0, ttl 64, id 46905, offset 0, flags [DF], proto TCP (6), length 56)
    192.168.128.254.34024 > 192.168.128.1.11111: Flags [P.], cksum 0x827b (incorrect -> 0x615c), seq 6483:6487, ack 320, win 502, options [nop,nop,TS val 3889318154 ecr 978132135], length 4
23:25:09.420312 IP (tos 0x0, ttl 64, id 35424, offset 0, flags [DF], proto TCP (6), length 52)
    192.168.128.1.11111 > 192.168.128.254.34024: Flags [.], cksum 0x8277 (incorrect -> 0x713b), ack 6487, win 501, options [nop,nop,TS val 978132178 ecr 3889318154], length 0
23:25:09.420360 IP (tos 0x0, ttl 64, id 46906, offset 0, flags [DF], proto TCP (6), length 644)
    192.168.128.254.34024 > 192.168.128.1.11111: Flags [P.], cksum 0x84c7 (incorrect -> 0xef81), seq 6487:7079, ack 320, win 502, options [nop,nop,TS val 3889318197 ecr 978132178], length 592
23:25:09.421561 IP (tos 0x0, ttl 64, id 35425, offset 0, flags [DF], proto TCP (6), length 52)
    192.168.128.1.11111 > 192.168.128.254.34024: Flags [.], cksum 0x8277 (incorrect -> 0x6ebf), ack 7079, win 501, options [nop,nop,TS val 978132179 ecr 3889318197], length 0
23:25:09.421567 IP (tos 0x0, ttl 64, id 35426, offset 0, flags [DF], proto TCP (6), length 84)
    192.168.128.1.11111 > 192.168.128.254.34024: Flags [P.], cksum 0x8297 (incorrect -> 0x0c35), seq 320:352, ack 7079, win 501, options [nop,nop,TS val 978132179 ecr 3889318197], length 32
23:25:09.422036 IP (tos 0x0, ttl 64, id 46907, offset 0, flags [DF], proto TCP (6), length 56)
    192.168.128.254.34024 > 192.168.128.1.11111: Flags [P.], cksum 0x827b (incorrect -> 0x5e90), seq 7079:7083, ack 352, win 502, options [nop,nop,TS val 3889318198 ecr 978132179], length 4
23:25:09.464228 IP (tos 0x0, ttl 64, id 35427, offset 0, flags [DF], proto TCP (6), length 52)
    192.168.128.1.11111 > 192.168.128.254.34024: Flags [.], cksum 0x8277 (incorrect -> 0x6e6f), ack 7083, win 501, options [nop,nop,TS val 978132222 ecr 3889318198], length 0
23:25:09.464275 IP (tos 0x0, ttl 64, id 46908, offset 0, flags [DF], proto TCP (6), length 714)
    192.168.128.254.34024 > 192.168.128.1.11111: Flags [P.], cksum 0x850d (incorrect -> 0x9bf4), seq 7083:7745, ack 352, win 502, options [nop,nop,TS val 3889318241 ecr 978132222], length 662
23:25:09.465517 IP (tos 0x0, ttl 64, id 35428, offset 0, flags [DF], proto TCP (6), length 52)
    192.168.128.1.11111 > 192.168.128.254.34024: Flags [.], cksum 0x8277 (incorrect -> 0x6bad), ack 7745, win 501, options [nop,nop,TS val 978132223 ecr 3889318241], length 0
23:25:09.465523 IP (tos 0x0, ttl 64, id 35429, offset 0, flags [DF], proto TCP (6), length 84)
    192.168.128.1.11111 > 192.168.128.254.34024: Flags [P.], cksum 0x8297 (incorrect -> 0xd822), seq 352:384, ack 7745, win 501, options [nop,nop,TS val 978132223 ecr 3889318241], length 32
23:25:09.466001 IP (tos 0x0, ttl 64, id 46909, offset 0, flags [DF], proto TCP (6), length 56)
    192.168.128.254.34024 > 192.168.128.1.11111: Flags [P.], cksum 0x827b (incorrect -> 0x5b7e), seq 7745:7749, ack 384, win 502, options [nop,nop,TS val 3889318242 ecr 978132223], length 4
23:25:09.508120 IP (tos 0x0, ttl 64, id 35430, offset 0, flags [DF], proto TCP (6), length 52)
    192.168.128.1.11111 > 192.168.128.254.34024: Flags [.], cksum 0x8277 (incorrect -> 0x6b5d), ack 7749, win 501, options [nop,nop,TS val 978132266 ecr 3889318242], length 0
23:25:09.508166 IP (tos 0x0, ttl 64, id 46910, offset 0, flags [DF], proto TCP (6), length 714)
    192.168.128.254.34024 > 192.168.128.1.11111: Flags [P.], cksum 0x850d (incorrect -> 0xdf7f), seq 7749:8411, ack 384, win 502, options [nop,nop,TS val 3889318285 ecr 978132266], length 662
23:25:09.509301 IP (tos 0x0, ttl 64, id 35431, offset 0, flags [DF], proto TCP (6), length 52)
    192.168.128.1.11111 > 192.168.128.254.34024: Flags [.], cksum 0x8277 (incorrect -> 0x689b), ack 8411, win 501, options [nop,nop,TS val 978132267 ecr 3889318285], length 0
23:25:09.509304 IP (tos 0x0, ttl 64, id 35432, offset 0, flags [DF], proto TCP (6), length 84)
    192.168.128.1.11111 > 192.168.128.254.34024: Flags [P.], cksum 0x8297 (incorrect -> 0xd510), seq 384:416, ack 8411, win 501, options [nop,nop,TS val 978132267 ecr 3889318285], length 32
23:25:09.509719 IP (tos 0x0, ttl 64, id 46911, offset 0, flags [DF], proto TCP (6), length 56)
    192.168.128.254.34024 > 192.168.128.1.11111: Flags [P.], cksum 0x827b (incorrect -> 0x586c), seq 8411:8415, ack 416, win 502, options [nop,nop,TS val 3889318286 ecr 978132267], length 4
23:25:09.552227 IP (tos 0x0, ttl 64, id 35433, offset 0, flags [DF], proto TCP (6), length 52)
    192.168.128.1.11111 > 192.168.128.254.34024: Flags [.], cksum 0x8277 (incorrect -> 0x684b), ack 8415, win 501, options [nop,nop,TS val 978132310 ecr 3889318286], length 0
23:25:09.552273 IP (tos 0x0, ttl 64, id 46912, offset 0, flags [DF], proto TCP (6), length 644)
    192.168.128.254.34024 > 192.168.128.1.11111: Flags [P.], cksum 0x84c7 (incorrect -> 0xa23c), seq 8415:9007, ack 416, win 502, options [nop,nop,TS val 3889318329 ecr 978132310], length 592
23:25:09.553435 IP (tos 0x0, ttl 64, id 35434, offset 0, flags [DF], proto TCP (6), length 52)
    192.168.128.1.11111 > 192.168.128.254.34024: Flags [.], cksum 0x8277 (incorrect -> 0x65cf), ack 9007, win 501, options [nop,nop,TS val 978132311 ecr 3889318329], length 0
23:25:09.553440 IP (tos 0x0, ttl 64, id 35435, offset 0, flags [DF], proto TCP (6), length 84)
    192.168.128.1.11111 > 192.168.128.254.34024: Flags [P.], cksum 0x8297 (incorrect -> 0x0345), seq 416:448, ack 9007, win 501, options [nop,nop,TS val 978132311 ecr 3889318329], length 32
23:25:09.553892 IP (tos 0x0, ttl 64, id 46913, offset 0, flags [DF], proto TCP (6), length 56)
    192.168.128.254.34024 > 192.168.128.1.11111: Flags [P.], cksum 0x827b (incorrect -> 0x55a0), seq 9007:9011, ack 448, win 502, options [nop,nop,TS val 3889318330 ecr 978132311], length 4
23:25:09.596228 IP (tos 0x0, ttl 64, id 35436, offset 0, flags [DF], proto TCP (6), length 52)
    192.168.128.1.11111 > 192.168.128.254.34024: Flags [.], cksum 0x8277 (incorrect -> 0x657f), ack 9011, win 501, options [nop,nop,TS val 978132354 ecr 3889318330], length 0
23:25:09.596275 IP (tos 0x0, ttl 64, id 46914, offset 0, flags [DF], proto TCP (6), length 644)
    192.168.128.254.34024 > 192.168.128.1.11111: Flags [P.], cksum 0x84c7 (incorrect -> 0x88b9), seq 9011:9603, ack 448, win 502, options [nop,nop,TS val 3889318373 ecr 978132354], length 592
23:25:09.597446 IP (tos 0x0, ttl 64, id 35437, offset 0, flags [DF], proto TCP (6), length 52)
    192.168.128.1.11111 > 192.168.128.254.34024: Flags [.], cksum 0x8277 (incorrect -> 0x6303), ack 9603, win 501, options [nop,nop,TS val 978132355 ecr 3889318373], length 0
23:25:09.597452 IP (tos 0x0, ttl 64, id 35438, offset 0, flags [DF], proto TCP (6), length 84)
    192.168.128.1.11111 > 192.168.128.254.34024: Flags [P.], cksum 0x8297 (incorrect -> 0x0079), seq 448:480, ack 9603, win 501, options [nop,nop,TS val 978132355 ecr 3889318373], length 32
23:25:09.597913 IP (tos 0x0, ttl 64, id 46915, offset 0, flags [DF], proto TCP (6), length 56)
    192.168.128.254.34024 > 192.168.128.1.11111: Flags [P.], cksum 0x827b (incorrect -> 0x52d4), seq 9603:9607, ack 480, win 502, options [nop,nop,TS val 3889318374 ecr 978132355], length 4
23:25:09.640327 IP (tos 0x0, ttl 64, id 35439, offset 0, flags [DF], proto TCP (6), length 52)
    192.168.128.1.11111 > 192.168.128.254.34024: Flags [.], cksum 0x8277 (incorrect -> 0x62b3), ack 9607, win 501, options [nop,nop,TS val 978132398 ecr 3889318374], length 0
23:25:09.640374 IP (tos 0x0, ttl 64, id 46916, offset 0, flags [DF], proto TCP (6), length 714)
    192.168.128.254.34024 > 192.168.128.1.11111: Flags [P.], cksum 0x850d (incorrect -> 0x1496), seq 9607:10269, ack 480, win 502, options [nop,nop,TS val 3889318417 ecr 978132398], length 662
23:25:09.641619 IP (tos 0x0, ttl 64, id 35440, offset 0, flags [DF], proto TCP (6), length 52)
    192.168.128.1.11111 > 192.168.128.254.34024: Flags [.], cksum 0x8277 (incorrect -> 0x5ff1), ack 10269, win 501, options [nop,nop,TS val 978132399 ecr 3889318417], length 0
23:25:09.641625 IP (tos 0x0, ttl 64, id 35441, offset 0, flags [DF], proto TCP (6), length 84)
    192.168.128.1.11111 > 192.168.128.254.34024: Flags [P.], cksum 0x8297 (incorrect -> 0xcc66), seq 480:512, ack 10269, win 501, options [nop,nop,TS val 978132399 ecr 3889318417], length 32
23:25:09.642088 IP (tos 0x0, ttl 64, id 46917, offset 0, flags [DF], proto TCP (6), length 56)
    192.168.128.254.34024 > 192.168.128.1.11111: Flags [P.], cksum 0x827b (incorrect -> 0x4fc1), seq 10269:10273, ack 512, win 502, options [nop,nop,TS val 3889318419 ecr 978132399], length 4
23:25:09.684214 IP (tos 0x0, ttl 64, id 35442, offset 0, flags [DF], proto TCP (6), length 52)
    192.168.128.1.11111 > 192.168.128.254.34024: Flags [.], cksum 0x8277 (incorrect -> 0x5fa0), ack 10273, win 501, options [nop,nop,TS val 978132442 ecr 3889318419], length 0
23:25:09.684283 IP (tos 0x0, ttl 64, id 46918, offset 0, flags [DF], proto TCP (6), length 714)
    192.168.128.254.34024 > 192.168.128.1.11111: Flags [P.], cksum 0x850d (incorrect -> 0x0756), seq 10273:10935, ack 512, win 502, options [nop,nop,TS val 3889318461 ecr 978132442], length 662
23:25:09.685370 IP (tos 0x0, ttl 64, id 35443, offset 0, flags [DF], proto TCP (6), length 52)
    192.168.128.1.11111 > 192.168.128.254.34024: Flags [.], cksum 0x8277 (incorrect -> 0x5cdf), ack 10935, win 501, options [nop,nop,TS val 978132443 ecr 3889318461], length 0
23:25:09.685376 IP (tos 0x0, ttl 64, id 35444, offset 0, flags [DF], proto TCP (6), length 84)
    192.168.128.1.11111 > 192.168.128.254.34024: Flags [P.], cksum 0x8297 (incorrect -> 0xc954), seq 512:544, ack 10935, win 501, options [nop,nop,TS val 978132443 ecr 3889318461], length 32
23:25:09.685900 IP (tos 0x0, ttl 64, id 46919, offset 0, flags [DF], proto TCP (6), length 56)
    192.168.128.254.34024 > 192.168.128.1.11111: Flags [P.], cksum 0x827b (incorrect -> 0x4cb0), seq 10935:10939, ack 544, win 502, options [nop,nop,TS val 3889318462 ecr 978132443], length 4
23:25:09.728262 IP (tos 0x0, ttl 64, id 35445, offset 0, flags [DF], proto TCP (6), length 52)
    192.168.128.1.11111 > 192.168.128.254.34024: Flags [.], cksum 0x8277 (incorrect -> 0x5c8f), ack 10939, win 501, options [nop,nop,TS val 978132486 ecr 3889318462], length 0
23:25:09.728315 IP (tos 0x0, ttl 64, id 46920, offset 0, flags [DF], proto TCP (6), length 714)
    192.168.128.254.34024 > 192.168.128.1.11111: Flags [P.], cksum 0x850d (incorrect -> 0x0708), seq 10939:11601, ack 544, win 502, options [nop,nop,TS val 3889318505 ecr 978132486], length 662
23:25:09.729556 IP (tos 0x0, ttl 64, id 35446, offset 0, flags [DF], proto TCP (6), length 52)
    192.168.128.1.11111 > 192.168.128.254.34024: Flags [.], cksum 0x8277 (incorrect -> 0x59cd), ack 11601, win 501, options [nop,nop,TS val 978132487 ecr 3889318505], length 0
23:25:09.729629 IP (tos 0x0, ttl 64, id 35447, offset 0, flags [DF], proto TCP (6), length 84)
    192.168.128.1.11111 > 192.168.128.254.34024: Flags [P.], cksum 0x8297 (incorrect -> 0xc642), seq 544:576, ack 11601, win 501, options [nop,nop,TS val 978132487 ecr 3889318505], length 32
23:25:09.730137 IP (tos 0x0, ttl 64, id 46921, offset 0, flags [DF], proto TCP (6), length 56)
    192.168.128.254.34024 > 192.168.128.1.11111: Flags [P.], cksum 0x827b (incorrect -> 0x499d), seq 11601:11605, ack 576, win 502, options [nop,nop,TS val 3889318507 ecr 978132487], length 4
23:25:09.772302 IP (tos 0x0, ttl 64, id 35448, offset 0, flags [DF], proto TCP (6), length 52)
    192.168.128.1.11111 > 192.168.128.254.34024: Flags [.], cksum 0x8277 (incorrect -> 0x597c), ack 11605, win 501, options [nop,nop,TS val 978132530 ecr 3889318507], length 0
23:25:09.772347 IP (tos 0x0, ttl 64, id 46922, offset 0, flags [DF], proto TCP (6), length 644)
    192.168.128.254.34024 > 192.168.128.1.11111: Flags [P.], cksum 0x84c7 (incorrect -> 0x943d), seq 11605:12197, ack 576, win 502, options [nop,nop,TS val 3889318549 ecr 978132530], length 592
23:25:09.773431 IP (tos 0x0, ttl 64, id 35449, offset 0, flags [DF], proto TCP (6), length 52)
    192.168.128.1.11111 > 192.168.128.254.34024: Flags [.], cksum 0x8277 (incorrect -> 0x5701), ack 12197, win 501, options [nop,nop,TS val 978132531 ecr 3889318549], length 0
23:25:09.773438 IP (tos 0x0, ttl 64, id 35450, offset 0, flags [DF], proto TCP (6), length 84)
    192.168.128.1.11111 > 192.168.128.254.34024: Flags [P.], cksum 0x8297 (incorrect -> 0xf476), seq 576:608, ack 12197, win 501, options [nop,nop,TS val 978132531 ecr 3889318549], length 32
23:25:09.773896 IP (tos 0x0, ttl 64, id 46923, offset 0, flags [DF], proto TCP (6), length 56)
    192.168.128.254.34024 > 192.168.128.1.11111: Flags [P.], cksum 0x827b (incorrect -> 0x46d2), seq 12197:12201, ack 608, win 502, options [nop,nop,TS val 3889318550 ecr 978132531], length 4
23:25:09.816245 IP (tos 0x0, ttl 64, id 35451, offset 0, flags [DF], proto TCP (6), length 52)
    192.168.128.1.11111 > 192.168.128.254.34024: Flags [.], cksum 0x8277 (incorrect -> 0x56b1), ack 12201, win 501, options [nop,nop,TS val 978132574 ecr 3889318550], length 0
23:25:09.816302 IP (tos 0x0, ttl 64, id 46924, offset 0, flags [DF], proto TCP (6), length 714)
    192.168.128.254.34024 > 192.168.128.1.11111: Flags [P.], cksum 0x850d (incorrect -> 0x3e8e), seq 12201:12863, ack 608, win 502, options [nop,nop,TS val 3889318593 ecr 978132574], length 662
23:25:09.817439 IP (tos 0x0, ttl 64, id 35452, offset 0, flags [DF], proto TCP (6), length 52)
    192.168.128.1.11111 > 192.168.128.254.34024: Flags [.], cksum 0x8277 (incorrect -> 0x53ef), ack 12863, win 501, options [nop,nop,TS val 978132575 ecr 3889318593], length 0
23:25:09.817446 IP (tos 0x0, ttl 64, id 35453, offset 0, flags [DF], proto TCP (6), length 84)
    192.168.128.1.11111 > 192.168.128.254.34024: Flags [P.], cksum 0x8297 (incorrect -> 0xc064), seq 608:640, ack 12863, win 501, options [nop,nop,TS val 978132575 ecr 3889318593], length 32
23:25:09.818031 IP (tos 0x0, ttl 64, id 46925, offset 0, flags [DF], proto TCP (6), length 56)
    192.168.128.254.34024 > 192.168.128.1.11111: Flags [P.], cksum 0x827b (incorrect -> 0x43c0), seq 12863:12867, ack 640, win 502, options [nop,nop,TS val 3889318594 ecr 978132575], length 4
23:25:09.860336 IP (tos 0x0, ttl 64, id 35454, offset 0, flags [DF], proto TCP (6), length 52)
    192.168.128.1.11111 > 192.168.128.254.34024: Flags [.], cksum 0x8277 (incorrect -> 0x539f), ack 12867, win 501, options [nop,nop,TS val 978132618 ecr 3889318594], length 0
23:25:09.860384 IP (tos 0x0, ttl 64, id 46926, offset 0, flags [DF], proto TCP (6), length 644)
    192.168.128.254.34024 > 192.168.128.1.11111: Flags [P.], cksum 0x84c7 (incorrect -> 0xaa2f), seq 12867:13459, ack 640, win 502, options [nop,nop,TS val 3889318637 ecr 978132618], length 592
23:25:09.861496 IP (tos 0x0, ttl 64, id 35455, offset 0, flags [DF], proto TCP (6), length 52)
    192.168.128.1.11111 > 192.168.128.254.34024: Flags [.], cksum 0x8277 (incorrect -> 0x5123), ack 13459, win 501, options [nop,nop,TS val 978132619 ecr 3889318637], length 0
23:25:09.861537 IP (tos 0x0, ttl 64, id 35456, offset 0, flags [DF], proto TCP (6), length 84)
    192.168.128.1.11111 > 192.168.128.254.34024: Flags [P.], cksum 0x8297 (incorrect -> 0xee98), seq 640:672, ack 13459, win 501, options [nop,nop,TS val 978132619 ecr 3889318637], length 32
23:25:09.861969 IP (tos 0x0, ttl 64, id 46927, offset 0, flags [DF], proto TCP (6), length 56)
    192.168.128.254.34024 > 192.168.128.1.11111: Flags [P.], cksum 0x827b (incorrect -> 0x40f4), seq 13459:13463, ack 672, win 502, options [nop,nop,TS val 3889318638 ecr 978132619], length 4
23:25:09.904280 IP (tos 0x0, ttl 64, id 35457, offset 0, flags [DF], proto TCP (6), length 52)
    192.168.128.1.11111 > 192.168.128.254.34024: Flags [.], cksum 0x8277 (incorrect -> 0x50d3), ack 13463, win 501, options [nop,nop,TS val 978132662 ecr 3889318638], length 0
23:25:09.904342 IP (tos 0x0, ttl 64, id 46928, offset 0, flags [DF], proto TCP (6), length 714)
    192.168.128.254.34024 > 192.168.128.1.11111: Flags [P.], cksum 0x850d (incorrect -> 0x7308), seq 13463:14125, ack 672, win 502, options [nop,nop,TS val 3889318681 ecr 978132662], length 662
23:25:09.905486 IP (tos 0x0, ttl 64, id 35458, offset 0, flags [DF], proto TCP (6), length 52)
    192.168.128.1.11111 > 192.168.128.254.34024: Flags [.], cksum 0x8277 (incorrect -> 0x4e11), ack 14125, win 501, options [nop,nop,TS val 978132663 ecr 3889318681], length 0
23:25:09.905491 IP (tos 0x0, ttl 64, id 35459, offset 0, flags [DF], proto TCP (6), length 84)
    192.168.128.1.11111 > 192.168.128.254.34024: Flags [P.], cksum 0x8297 (incorrect -> 0xba86), seq 672:704, ack 14125, win 501, options [nop,nop,TS val 978132663 ecr 3889318681], length 32
23:25:09.906045 IP (tos 0x0, ttl 64, id 46929, offset 0, flags [DF], proto TCP (6), length 56)
    192.168.128.254.34024 > 192.168.128.1.11111: Flags [P.], cksum 0x827b (incorrect -> 0x3de2), seq 14125:14129, ack 704, win 502, options [nop,nop,TS val 3889318682 ecr 978132663], length 4
23:25:09.948181 IP (tos 0x0, ttl 64, id 35460, offset 0, flags [DF], proto TCP (6), length 52)
    192.168.128.1.11111 > 192.168.128.254.34024: Flags [.], cksum 0x8277 (incorrect -> 0x4dc1), ack 14129, win 501, options [nop,nop,TS val 978132706 ecr 3889318682], length 0
23:25:09.948227 IP (tos 0x0, ttl 64, id 46930, offset 0, flags [DF], proto TCP (6), length 714)
    192.168.128.254.34024 > 192.168.128.1.11111: Flags [P.], cksum 0x850d (incorrect -> 0xc116), seq 14129:14791, ack 704, win 502, options [nop,nop,TS val 3889318725 ecr 978132706], length 662
23:25:09.949296 IP (tos 0x0, ttl 64, id 35461, offset 0, flags [DF], proto TCP (6), length 52)
    192.168.128.1.11111 > 192.168.128.254.34024: Flags [.], cksum 0x8277 (incorrect -> 0x4aff), ack 14791, win 501, options [nop,nop,TS val 978132707 ecr 3889318725], length 0
23:25:09.949298 IP (tos 0x0, ttl 64, id 35462, offset 0, flags [DF], proto TCP (6), length 84)
    192.168.128.1.11111 > 192.168.128.254.34024: Flags [P.], cksum 0x8297 (incorrect -> 0xb774), seq 704:736, ack 14791, win 501, options [nop,nop,TS val 978132707 ecr 3889318725], length 32
23:25:09.949731 IP (tos 0x0, ttl 64, id 46931, offset 0, flags [DF], proto TCP (6), length 56)
    192.168.128.254.34024 > 192.168.128.1.11111: Flags [P.], cksum 0x827b (incorrect -> 0x3ad0), seq 14791:14795, ack 736, win 502, options [nop,nop,TS val 3889318726 ecr 978132707], length 4
23:25:09.992211 IP (tos 0x0, ttl 64, id 35463, offset 0, flags [DF], proto TCP (6), length 52)
    192.168.128.1.11111 > 192.168.128.254.34024: Flags [.], cksum 0x8277 (incorrect -> 0x4aaf), ack 14795, win 501, options [nop,nop,TS val 978132750 ecr 3889318726], length 0
23:25:09.992261 IP (tos 0x0, ttl 64, id 46932, offset 0, flags [DF], proto TCP (6), length 714)
    192.168.128.254.34024 > 192.168.128.1.11111: Flags [P.], cksum 0x850d (incorrect -> 0x6579), seq 14795:15457, ack 736, win 502, options [nop,nop,TS val 3889318769 ecr 978132750], length 662
23:25:09.993529 IP (tos 0x0, ttl 64, id 35464, offset 0, flags [DF], proto TCP (6), length 52)
    192.168.128.1.11111 > 192.168.128.254.34024: Flags [.], cksum 0x8277 (incorrect -> 0x47ed), ack 15457, win 501, options [nop,nop,TS val 978132751 ecr 3889318769], length 0
23:25:09.993536 IP (tos 0x0, ttl 64, id 35465, offset 0, flags [DF], proto TCP (6), length 84)
    192.168.128.1.11111 > 192.168.128.254.34024: Flags [P.], cksum 0x8297 (incorrect -> 0xb462), seq 736:768, ack 15457, win 501, options [nop,nop,TS val 978132751 ecr 3889318769], length 32
23:25:09.994047 IP (tos 0x0, ttl 64, id 46933, offset 0, flags [DF], proto TCP (6), length 56)
    192.168.128.254.34024 > 192.168.128.1.11111: Flags [P.], cksum 0x827b (incorrect -> 0x37be), seq 15457:15461, ack 768, win 502, options [nop,nop,TS val 3889318770 ecr 978132751], length 4
23:25:10.036321 IP (tos 0x0, ttl 64, id 35466, offset 0, flags [DF], proto TCP (6), length 52)
    192.168.128.1.11111 > 192.168.128.254.34024: Flags [.], cksum 0x8277 (incorrect -> 0x479d), ack 15461, win 501, options [nop,nop,TS val 978132794 ecr 3889318770], length 0
23:25:10.036367 IP (tos 0x0, ttl 64, id 46934, offset 0, flags [DF], proto TCP (6), length 644)
    192.168.128.254.34024 > 192.168.128.1.11111: Flags [P.], cksum 0x84c7 (incorrect -> 0x035a), seq 15461:16053, ack 768, win 502, options [nop,nop,TS val 3889318813 ecr 978132794], length 592
23:25:10.037525 IP (tos 0x0, ttl 64, id 35467, offset 0, flags [DF], proto TCP (6), length 52)
    192.168.128.1.11111 > 192.168.128.254.34024: Flags [.], cksum 0x8277 (incorrect -> 0x4521), ack 16053, win 501, options [nop,nop,TS val 978132795 ecr 3889318813], length 0
23:25:10.037531 IP (tos 0x0, ttl 64, id 35468, offset 0, flags [DF], proto TCP (6), length 84)
    192.168.128.1.11111 > 192.168.128.254.34024: Flags [P.], cksum 0x8297 (incorrect -> 0xe296), seq 768:800, ack 16053, win 501, options [nop,nop,TS val 978132795 ecr 3889318813], length 32
23:25:10.037979 IP (tos 0x0, ttl 64, id 46935, offset 0, flags [DF], proto TCP (6), length 56)
    192.168.128.254.34024 > 192.168.128.1.11111: Flags [P.], cksum 0x827b (incorrect -> 0x34f2), seq 16053:16057, ack 800, win 502, options [nop,nop,TS val 3889318814 ecr 978132795], length 4
23:25:10.080316 IP (tos 0x0, ttl 64, id 35469, offset 0, flags [DF], proto TCP (6), length 52)
    192.168.128.1.11111 > 192.168.128.254.34024: Flags [.], cksum 0x8277 (incorrect -> 0x44d1), ack 16057, win 501, options [nop,nop,TS val 978132838 ecr 3889318814], length 0
23:25:10.080363 IP (tos 0x0, ttl 64, id 46936, offset 0, flags [DF], proto TCP (6), length 714)
    192.168.128.254.34024 > 192.168.128.1.11111: Flags [P.], cksum 0x850d (incorrect -> 0x6a9c), seq 16057:16719, ack 800, win 502, options [nop,nop,TS val 3889318857 ecr 978132838], length 662
23:25:10.081611 IP (tos 0x0, ttl 64, id 35470, offset 0, flags [DF], proto TCP (6), length 52)
    192.168.128.1.11111 > 192.168.128.254.34024: Flags [.], cksum 0x8277 (incorrect -> 0x420f), ack 16719, win 501, options [nop,nop,TS val 978132839 ecr 3889318857], length 0
23:25:10.081617 IP (tos 0x0, ttl 64, id 35471, offset 0, flags [DF], proto TCP (6), length 84)
    192.168.128.1.11111 > 192.168.128.254.34024: Flags [P.], cksum 0x8297 (incorrect -> 0xae84), seq 800:832, ack 16719, win 501, options [nop,nop,TS val 978132839 ecr 3889318857], length 32
23:25:10.082119 IP (tos 0x0, ttl 64, id 46937, offset 0, flags [DF], proto TCP (6), length 56)
    192.168.128.254.34024 > 192.168.128.1.11111: Flags [P.], cksum 0x827b (incorrect -> 0x31df), seq 16719:16723, ack 832, win 502, options [nop,nop,TS val 3889318859 ecr 978132839], length 4
23:25:10.124312 IP (tos 0x0, ttl 64, id 35472, offset 0, flags [DF], proto TCP (6), length 52)
    192.168.128.1.11111 > 192.168.128.254.34024: Flags [.], cksum 0x8277 (incorrect -> 0x41be), ack 16723, win 501, options [nop,nop,TS val 978132882 ecr 3889318859], length 0
23:25:10.124359 IP (tos 0x0, ttl 64, id 46938, offset 0, flags [DF], proto TCP (6), length 644)
    192.168.128.254.34024 > 192.168.128.1.11111: Flags [P.], cksum 0x84c7 (incorrect -> 0xe9dc), seq 16723:17315, ack 832, win 502, options [nop,nop,TS val 3889318901 ecr 978132882], length 592
23:25:10.125489 IP (tos 0x0, ttl 64, id 35473, offset 0, flags [DF], proto TCP (6), length 52)
    192.168.128.1.11111 > 192.168.128.254.34024: Flags [.], cksum 0x8277 (incorrect -> 0x3f43), ack 17315, win 501, options [nop,nop,TS val 978132883 ecr 3889318901], length 0
23:25:10.125495 IP (tos 0x0, ttl 64, id 35474, offset 0, flags [DF], proto TCP (6), length 84)
    192.168.128.1.11111 > 192.168.128.254.34024: Flags [P.], cksum 0x8297 (incorrect -> 0xdcb8), seq 832:864, ack 17315, win 501, options [nop,nop,TS val 978132883 ecr 3889318901], length 32
23:25:10.125980 IP (tos 0x0, ttl 64, id 46939, offset 0, flags [DF], proto TCP (6), length 56)
    192.168.128.254.34024 > 192.168.128.1.11111: Flags [P.], cksum 0x827b (incorrect -> 0x2f14), seq 17315:17319, ack 864, win 502, options [nop,nop,TS val 3889318902 ecr 978132883], length 4
23:25:10.168324 IP (tos 0x0, ttl 64, id 35475, offset 0, flags [DF], proto TCP (6), length 52)
    192.168.128.1.11111 > 192.168.128.254.34024: Flags [.], cksum 0x8277 (incorrect -> 0x3ef3), ack 17319, win 501, options [nop,nop,TS val 978132926 ecr 3889318902], length 0
23:25:10.168369 IP (tos 0x0, ttl 64, id 46940, offset 0, flags [DF], proto TCP (6), length 714)
    192.168.128.254.34024 > 192.168.128.1.11111: Flags [P.], cksum 0x850d (incorrect -> 0x81ee), seq 17319:17981, ack 864, win 502, options [nop,nop,TS val 3889318945 ecr 978132926], length 662
23:25:10.169613 IP (tos 0x0, ttl 64, id 35476, offset 0, flags [DF], proto TCP (6), length 52)
    192.168.128.1.11111 > 192.168.128.254.34024: Flags [.], cksum 0x8277 (incorrect -> 0x3c31), ack 17981, win 501, options [nop,nop,TS val 978132927 ecr 3889318945], length 0
23:25:10.169619 IP (tos 0x0, ttl 64, id 35477, offset 0, flags [DF], proto TCP (6), length 84)
    192.168.128.1.11111 > 192.168.128.254.34024: Flags [P.], cksum 0x8297 (incorrect -> 0xa8a6), seq 864:896, ack 17981, win 501, options [nop,nop,TS val 978132927 ecr 3889318945], length 32
23:25:10.170155 IP (tos 0x0, ttl 64, id 46941, offset 0, flags [DF], proto TCP (6), length 56)
    192.168.128.254.34024 > 192.168.128.1.11111: Flags [P.], cksum 0x827b (incorrect -> 0x2c01), seq 17981:17985, ack 896, win 502, options [nop,nop,TS val 3889318947 ecr 978132927], length 4
23:25:10.212249 IP (tos 0x0, ttl 64, id 35478, offset 0, flags [DF], proto TCP (6), length 52)
    192.168.128.1.11111 > 192.168.128.254.34024: Flags [.], cksum 0x8277 (incorrect -> 0x3be0), ack 17985, win 501, options [nop,nop,TS val 978132970 ecr 3889318947], length 0
23:25:10.212295 IP (tos 0x0, ttl 64, id 46942, offset 0, flags [DF], proto TCP (6), length 644)
    192.168.128.254.34024 > 192.168.128.1.11111: Flags [P.], cksum 0x84c7 (incorrect -> 0x7320), seq 17985:18577, ack 896, win 502, options [nop,nop,TS val 3889318989 ecr 978132970], length 592
23:25:10.213453 IP (tos 0x0, ttl 64, id 35479, offset 0, flags [DF], proto TCP (6), length 52)
